{
 "meta": {
  "pack": "indigenous-australia",
  "version": 1,
  "created": "2026-10-22",
  "map_caveat": "Boundaries approximate and contested (AIATSIS map caveat); not suitable for native title or land claims; only Traditional Custodians can speak for Country.",
  "deceased_persons_warning_default": "Aboriginal and Torres Strait Islander visitors are advised that this site may contain images, voices or names of people who have died.",
  "deceased_warning_note": "Warning text is a standard convention (inference); no deceased persons are named in this pack."
 },
 "knowledge": [
  {
   "id": "k1",
   "text": "The AIATSIS map (created 1996 by David R Horton for the Encyclopaedia of Aboriginal Australia) attempts to represent language, social or nation groups using published sources from the 18th century to 1994; it shows general locations of larger groupings, borders are deliberately blurred, some information is contested, and it is not suitable for native title or land claims.",
   "sources": [
    "aiatsis-map"
   ],
   "label": "evidence"
  },
  {
   "id": "k2",
   "text": "The AIATSIS map may not be cropped, overlaid, or have geospatial mapping added; reproduction requires Aboriginal Studies Press permission and AIATSIS does not provide GIS data. Sites should LINK to it rather than embed or redraw it.",
   "sources": [
    "aiatsis-perm"
   ],
   "label": "evidence",
   "sensitivity": "licensing"
  },
  {
   "id": "k3",
   "text": "At colonisation there were more than 250 Indigenous languages including about 800 dialects; NILS3 (2018-19) found 123 still spoken, 109 endangered and 14 strong, with at least 31 being reawakened.",
   "sources": [
    "aiatsis-langs",
    "aiatsis-nils3"
   ],
   "label": "evidence (figures via AIATSIS summary; verify exact wording on page before publishing)"
  },
  {
   "id": "k4",
   "text": "Anangu state that 'Dreamtime'/'Dreaming' suggests beliefs are unreal; Tjukurpa is not a dream and there is no word 'Dreamtime' in Anangu languages. Tjukurpa is the foundation of law, religion and morality.",
   "sources": [
    "uluru-tjukurpa"
   ],
   "label": "evidence"
  },
  {
   "id": "k5",
   "text": "Some Tjukurpa knowledge is passed only to people who have inherited the right to it; sacred objects, some designs and sounds (e.g. bullroarer) are restricted, sometimes by gender.",
   "sources": [
    "uluru-stories",
    "uluru-tjukurpa"
   ],
   "label": "evidence",
   "sensitivity": "restricted-knowledge-exists; content excluded"
  },
  {
   "id": "k6",
   "text": "AustLang assigns each language variety a stable alphanumeric code; the letter denotes a region (P = contact languages, T = Tasmanian), from Arthur Capell's 1963 scheme.",
   "sources": [
    "austlang-help"
   ],
   "label": "evidence"
  },
  {
   "id": "k7",
   "text": "Pitjantjatjara (C6) and Yankunytjatjara (C4) are dialects of the Western Desert language (A80); many Pitjantjatjara people live with Yankunytjatjara at Amata, Ernabella, Fregon, Mimili and Indulkana.",
   "sources": [
    "austlang-c6",
    "austlang-c4"
   ],
   "label": "evidence"
  },
  {
   "id": "k8",
   "text": "Torres Strait Islanders are united by Tagai stories, which centre on the stars and identify them as sea people.",
   "sources": [
    "qcaa-tagai"
   ],
   "label": "evidence"
  },
  {
   "id": "k9",
   "text": "'Zenadth Kes' is a name used instead of 'Torres Strait', created by Elder and linguist Adhi Ephraim Bani from traditional names of the four winds.",
   "sources": [
    "austlang-y3"
   ],
   "label": "evidence"
  },
  {
   "id": "k10",
   "text": "Torres Strait Creole (P2) is shared across Zenadth Kes; Meriam Mir (Y3, eastern; a Papuan language) and Kala Lagaw Ya (Y1, western) are traditional languages under community-led revitalisation.",
   "sources": [
    "austlang-y3"
   ],
   "label": "evidence"
  },
  {
   "id": "k11",
   "text": "TSRA supports 17 inhabited islands of the Torres Strait plus Bamaga and Seisia on the Northern Peninsula Area.",
   "sources": [
    "tsra"
   ],
   "label": "evidence"
  },
  {
   "id": "k12",
   "text": "Erubam Le (Erub/Darnley Island) calendar Erub Kerker has 4 main seasons; Tagai's position signals voyaging, turtle mating, garden times, wind change and monsoon. Produced 2021 with Elders, Erubam Rangers and TSRA TEK team.",
   "sources": [
    "bom-erub-island"
   ],
   "label": "evidence",
   "nation": "Erubam Le"
  },
  {
   "id": "k13",
   "text": "Masig (Yorke Island) seasonal calendar produced 2018 with Masigalgal RNTBC and Masigalgal Rangers; Masig is a small low-lying coral cay in the Central Islands about 160 km north-east of Thursday Island.",
   "sources": [
    "bom-masig"
   ],
   "label": "evidence",
   "nation": "Masigalgal"
  },
  {
   "id": "k14",
   "text": "Nyoongar seasonal calendar has 6 seasons: Birak, Bunuru, Djeran, Makuru, Djilba and Kambarang.",
   "sources": [
    "bom-nyoongar"
   ],
   "label": "evidence",
   "nation": "Noongar"
  },
  {
   "id": "k15",
   "text": "Yawuru calendar (Broome, WA) has 6 seasons, e.g. Man-gala, the wet season (Dec-Mar).",
   "sources": [
    "bom-yawuru"
   ],
   "label": "evidence",
   "nation": "Yawuru"
  },
  {
   "id": "k16",
   "text": "Jawoyn calendar (Katherine region, NT) has 5 seasons defined by weather and environment.",
   "sources": [
    "bom-jawoyn"
   ],
   "label": "evidence",
   "nation": "Jawoyn"
  },
  {
   "id": "k17",
   "text": "Maung calendar (Goulburn Islands, off Arnhem Land) explains plant and animal indicators of seasons.",
   "sources": [
    "bom-maung"
   ],
   "label": "evidence",
   "nation": "Maung"
  },
  {
   "id": "k18",
   "text": "Tiwi calendar recognises 3 major and 13 minor seasons.",
   "sources": [
    "bom-tiwi"
   ],
   "label": "evidence",
   "nation": "Tiwi"
  },
  {
   "id": "k19",
   "text": "Yanyuwa calendar (Gulf of Carpentaria) has 5 seasons, starting with Wunthurru, the early storm season.",
   "sources": [
    "bom-yanyuwa"
   ],
   "label": "evidence",
   "nation": "Yanyuwa"
  },
  {
   "id": "k20",
   "text": "Miriwoong calendar (Kununurra, WA) has 3 major seasons: hot, wet and cold.",
   "sources": [
    "bom-miriwoong"
   ],
   "label": "evidence",
   "nation": "Miriwoong"
  },
  {
   "id": "k21",
   "text": "Kaurna calendar (Adelaide Plains) recognises 4 weather periods plus seasonal-indicator winds; mapping to European months is approximate.",
   "sources": [
    "bom-kaurna"
   ],
   "label": "evidence",
   "nation": "Kaurna"
  },
  {
   "id": "k22",
   "text": "Brambuk seasonal cycle of Gariwerd (Grampians, Vic) recognises 6 seasons.",
   "sources": [
    "bom-gariwerd"
   ],
   "label": "evidence",
   "nation": "Djab Wurrung / Jardwadjali (inference: nations of Gariwerd; not named in cited snippet)"
  },
  {
   "id": "k23",
   "text": "D'harawal Country and language area extends from the southern shores of Port Jackson toward the Shoalhaven River; BOM publishes a D'harawal seasonal calendar.",
   "sources": [
    "bom-dharawal"
   ],
   "label": "evidence",
   "nation": "D'harawal"
  },
  {
   "id": "k24",
   "text": "Banbai calendar relates to the 650 ha Wattleridge Indigenous Protected Area, NSW.",
   "sources": [
    "bom-banbai"
   ],
   "label": "evidence",
   "nation": "Banbai"
  },
  {
   "id": "k25",
   "text": "At Kata Tjuta the ancestral beings' activities are so sensitive that not even their names can be revealed; it is a men's site and its Tjukurpa is not shared with visitors.",
   "sources": [
    "uluru-kata"
   ],
   "label": "evidence",
   "sensitivity": "RESTRICTED - do not seek or publish stories"
  },
  {
   "id": "k26",
   "text": "palawa kani means 'Tasmanian Aborigines speak' and is the only Aboriginal language in lutruwita/Tasmania today; the TAC palawa kani Language Program has revived it since the early 1990s.",
   "sources": [
    "tac-pk"
   ],
   "label": "evidence",
   "nation": "palawa"
  },
  {
   "id": "k27",
   "text": "palawa kani is a composite language revived from historical records of the original Tasmanian languages.",
   "sources": [
    "aph-tac"
   ],
   "label": "evidence",
   "nation": "palawa"
  },
  {
   "id": "k28",
   "text": "AustLang lists historical Tasmanian varieties T1-T15, which with historical sources underpin palawa kani (T16); estimates of the original number of languages run from about 8 to 12.",
   "sources": [
    "austlang-t3"
   ],
   "label": "evidence",
   "nation": "palawa",
   "uncertainty": "number of original languages uncertain"
  },
  {
   "id": "k29",
   "text": "The TAC lists 16 gazetted Aboriginal or dual names in palawa kani, e.g. truwana (Cape Barren Island), kunanyi (Mt Wellington), kanamaluka (Tamar), takayna (Tarkine), larapuna (Bay of Fires), putalina (Oyster Cove).",
   "sources": [
    "tac-names"
   ],
   "label": "evidence",
   "nation": "palawa"
  },
  {
   "id": "k30",
   "text": "lutruwita is the palawa kani name for Tasmania, revived from G.A. Robinson's records.",
   "sources": [
    "tac-names-arch"
   ],
   "label": "evidence",
   "nation": "palawa"
  },
  {
   "id": "k31",
   "text": "Arrernte (C8) covers Eastern and Central Arrernte, spoken in places including Mparntwe (Alice Springs), Santa Teresa and Harts Range; Alyawarr (C14) is a related Arandic language.",
   "sources": [
    "austlang-c8",
    "austlang-c14"
   ],
   "label": "evidence",
   "nation": "Arrernte"
  },
  {
   "id": "k32",
   "text": "Warlpiri (C15; people call themselves Yapa); communities include Yuendumu, Lajamanu, Nyirrpi and Willowra.",
   "sources": [
    "austlang-c15"
   ],
   "label": "evidence",
   "nation": "Warlpiri"
  },
  {
   "id": "k33",
   "text": "The ranges around Alice Springs are part of the caterpillar dreaming that tells how Mparntwe was formed; Anthwerrke (Emily Gap) is where the caterpillar songlines Yeperenye, Ntyarlke and Utnerrengatye intersect.",
   "sources": [
    "nt-yeperenye",
    "clc-anthwerrke"
   ],
   "label": "evidence",
   "nation": "Arrernte"
  },
  {
   "id": "k34",